{
  "format": "http-sequence-diff",
  "schema_version": "1.0",
  "engine": {
    "name": "@http-sequence-logger/sequence-diff",
    "version": "0.1.0",
    "algorithm": "conservative-tree-v1"
  },
  "inputs": {
    "primary": {
      "session": {
        "namespace": "sample-app/android",
        "id": "sess_25cc-demo-handler"
      },
      "event_count": 33,
      "recording_count": 1
    },
    "secondary": {
      "session": {
        "namespace": "sample-app/android",
        "id": "sess_7e02-demo-handler-rerun"
      },
      "event_count": 37,
      "recording_count": 1
    }
  },
  "profile": {
    "ignore_paths": [],
    "ignore_headers": [
      "x-request-id",
      "date"
    ],
    "compare_timing": false,
    "json_fields": true,
    "matches": [],
    "recording_matches": []
  },
  "scope": {
    "included": [
      "recordings",
      "operations",
      "handler invocations",
      "HTTP exchanges",
      "request/response metadata",
      "ordered repeated headers and query values",
      "raw bodies",
      "JSON body fields (complete, unredacted UTF-8 JSON only)",
      "outcomes and attempts",
      "sibling order relations"
    ],
    "excluded": [
      "wall-clock timestamps",
      "monotonic clock origins",
      "native transport metrics (compared as metadata only)",
      "handler arguments and return values (not captured)",
      "timing (compare_timing=false)",
      "header x-request-id",
      "header date"
    ]
  },
  "result": "different",
  "summary": {
    "matched": 8,
    "primary_only": 2,
    "secondary_only": 2,
    "unresolved": 3,
    "changed_pairs": 3,
    "equal_pairs": 5,
    "uncertain_pairs": 9,
    "order_changes": 2,
    "field_changes": 12
  },
  "pairs": [
    {
      "id": "p001",
      "parent_pair_id": null,
      "primary": {
        "recording_id": "rec_e1",
        "node_id": "rec_e1",
        "kind": "recording",
        "label": "Recording rec_e1",
        "position": 0,
        "parent_node_id": null,
        "event_ids": [
          "L172"
        ],
        "event_pointers": [
          "/events/171"
        ]
      },
      "secondary": {
        "recording_id": "rec_g1",
        "node_id": "rec_g1",
        "kind": "recording",
        "label": "Recording rec_g1",
        "position": 0,
        "parent_node_id": null,
        "event_ids": [
          "L251"
        ],
        "event_pointers": [
          "/events/250"
        ]
      },
      "presence": "both",
      "matching": {
        "basis": "signature",
        "confidence": "exact",
        "candidate_node_ids": []
      },
      "equivalence": "equal",
      "changes": [],
      "uncertainties": [],
      "ignored_paths": []
    },
    {
      "id": "p002",
      "parent_pair_id": "p001",
      "primary": {
        "recording_id": "rec_e1",
        "node_id": "op_signin",
        "kind": "operation",
        "label": "SampleApp.signIn(handler)",
        "position": 0,
        "parent_node_id": "rec_e1",
        "event_ids": [
          "L173",
          "L202"
        ],
        "event_pointers": [
          "/events/172",
          "/events/201"
        ]
      },
      "secondary": {
        "recording_id": "rec_g1",
        "node_id": "op_signin",
        "kind": "operation",
        "label": "SampleApp.signIn(handler)",
        "position": 0,
        "parent_node_id": "rec_g1",
        "event_ids": [
          "L252",
          "L285"
        ],
        "event_pointers": [
          "/events/251",
          "/events/284"
        ]
      },
      "presence": "both",
      "matching": {
        "basis": "signature",
        "confidence": "exact",
        "candidate_node_ids": []
      },
      "equivalence": "equal",
      "changes": [],
      "uncertainties": [],
      "ignored_paths": []
    },
    {
      "id": "p003",
      "parent_pair_id": "p002",
      "primary": {
        "recording_id": "rec_e1",
        "node_id": "op_auth",
        "kind": "operation",
        "label": "DemoAuthSdk.authenticate(handler)",
        "position": 1,
        "parent_node_id": "op_signin",
        "event_ids": [
          "L174",
          "L195"
        ],
        "event_pointers": [
          "/events/173",
          "/events/194"
        ]
      },
      "secondary": {
        "recording_id": "rec_g1",
        "node_id": "op_auth",
        "kind": "operation",
        "label": "DemoAuthSdk.authenticate(handler)",
        "position": 1,
        "parent_node_id": "op_signin",
        "event_ids": [
          "L253",
          "L280"
        ],
        "event_pointers": [
          "/events/252",
          "/events/279"
        ]
      },
      "presence": "both",
      "matching": {
        "basis": "signature",
        "confidence": "exact",
        "candidate_node_ids": []
      },
      "equivalence": "equal",
      "changes": [],
      "uncertainties": [],
      "ignored_paths": []
    },
    {
      "id": "p004",
      "parent_pair_id": "p003",
      "primary": {
        "recording_id": "rec_e1",
        "node_id": "r1",
        "kind": "http",
        "label": "GET /uuid",
        "position": 2,
        "parent_node_id": "op_auth",
        "event_ids": [
          "L175",
          "L176",
          "L177",
          "L178"
        ],
        "event_pointers": [
          "/events/174",
          "/events/175",
          "/events/176",
          "/events/177"
        ]
      },
      "secondary": {
        "recording_id": "rec_g1",
        "node_id": "r1",
        "kind": "http",
        "label": "GET /uuid",
        "position": 3,
        "parent_node_id": "op_auth",
        "event_ids": [
          "L258",
          "L259",
          "L260",
          "L261"
        ],
        "event_pointers": [
          "/events/257",
          "/events/258",
          "/events/259",
          "/events/260"
        ]
      },
      "presence": "both",
      "matching": {
        "basis": "signature",
        "confidence": "exact",
        "candidate_node_ids": []
      },
      "equivalence": "different",
      "changes": [
        {
          "path": "/request/headers/User-Agent",
          "dimension": "content",
          "primary": {
            "present": true,
            "value": [
              "DemoAuth/2.4.0 (Android 14; okhttp/4.12.0)"
            ]
          },
          "secondary": {
            "present": true,
            "value": [
              "DemoAuth/2.4.1 (Android 14; okhttp/4.12.0)"
            ]
          }
        },
        {
          "path": "/response_body/raw",
          "dimension": "content",
          "primary": {
            "present": true,
            "value": "{\"uuid\":\"ee324ee9-21bb-47d2-a0a1-41d71cbb468f\"}"
          },
          "secondary": {
            "present": true,
            "value": "{\"uuid\":\"0b7c2d6e-5f21-4e7a-9c3b-2a1d4f6e8b90\"}"
          }
        },
        {
          "path": "/response_body/json/uuid",
          "dimension": "content",
          "primary": {
            "present": true,
            "value": "ee324ee9-21bb-47d2-a0a1-41d71cbb468f"
          },
          "secondary": {
            "present": true,
            "value": "0b7c2d6e-5f21-4e7a-9c3b-2a1d4f6e8b90"
          }
        }
      ],
      "uncertainties": [],
      "ignored_paths": []
    },
    {
      "id": "p005",
      "parent_pair_id": "p003",
      "primary": {
        "recording_id": "rec_e1",
        "node_id": "r2",
        "kind": "http",
        "label": "POST /auth/login",
        "position": 3,
        "parent_node_id": "op_auth",
        "event_ids": [
          "L179",
          "L180",
          "L181",
          "L182"
        ],
        "event_pointers": [
          "/events/178",
          "/events/179",
          "/events/180",
          "/events/181"
        ]
      },
      "secondary": {
        "recording_id": "rec_g1",
        "node_id": "r2",
        "kind": "http",
        "label": "POST /auth/login",
        "position": 2,
        "parent_node_id": "op_auth",
        "event_ids": [
          "L254",
          "L255",
          "L256",
          "L257"
        ],
        "event_pointers": [
          "/events/253",
          "/events/254",
          "/events/255",
          "/events/256"
        ]
      },
      "presence": "both",
      "matching": {
        "basis": "signature",
        "confidence": "exact",
        "candidate_node_ids": []
      },
      "equivalence": "different",
      "changes": [
        {
          "path": "/request/headers/User-Agent",
          "dimension": "content",
          "primary": {
            "present": true,
            "value": [
              "DemoAuth/2.4.0 (Android 14; okhttp/4.12.0)"
            ]
          },
          "secondary": {
            "present": true,
            "value": [
              "DemoAuth/2.4.1 (Android 14; okhttp/4.12.0)"
            ]
          }
        }
      ],
      "uncertainties": [
        {
          "path": "/request_body/raw",
          "reason": "redaction markers replace original values; identical markers do not establish equal originals (primary: redacted, secondary: redacted)."
        },
        {
          "path": "/response_body/raw",
          "reason": "redaction markers replace original values; identical markers do not establish equal originals (primary: redacted, secondary: redacted)."
        }
      ],
      "ignored_paths": []
    },
    {
      "id": "p006",
      "parent_pair_id": "p003",
      "primary": {
        "recording_id": "rec_e1",
        "node_id": "r3",
        "kind": "http",
        "label": "GET /auth/me",
        "position": 4,
        "parent_node_id": "op_auth",
        "event_ids": [
          "L183",
          "L184",
          "L185",
          "L186"
        ],
        "event_pointers": [
          "/events/182",
          "/events/183",
          "/events/184",
          "/events/185"
        ]
      },
      "secondary": null,
      "presence": "unresolved",
      "matching": {
        "basis": "ambiguous",